"Status","Start Time","Stop Time","Duration in ms","Parent Suite","Suite","Sub Suite","Test Class","Test Method","Name","Description"
"passed","Mon Dec 20 06:37:58 GMT 2021","Mon Dec 20 06:38:02 GMT 2021","3729","tests.Buying","test_success_buying_several_products","","","","Проверка возможности совершить покупку нескольких товаров",""
"passed","Mon Dec 20 06:37:44 GMT 2021","Mon Dec 20 06:37:47 GMT 2021","2609","tests.Basket","test_checking_basket_form","","","","Проверка стартового состояния Корзины",""
"passed","Mon Dec 20 06:37:47 GMT 2021","Mon Dec 20 06:37:51 GMT 2021","4647","tests.Basket","test_cleaning_basket_after_buying","","","","Проверка очистки формы Корзины после совершения покупки",""
"passed","Mon Dec 20 06:37:52 GMT 2021","Mon Dec 20 06:37:55 GMT 2021","3414","tests.Basket","test_deleting_products_from_basket","","","","Проверка очистки формы Корзины до совершения покупки",""
"passed","Mon Dec 20 06:38:02 GMT 2021","Mon Dec 20 06:38:02 GMT 2021","370","tests.Search","test_failed_searching","","","","Проверка поиска несуществующего продукта",""
"passed","Mon Dec 20 06:37:55 GMT 2021","Mon Dec 20 06:37:58 GMT 2021","2614","tests.Buying","test_success_buying_one_product","","","","Проверка возможности совершить покупку единственного товара",""
"passed","Mon Dec 20 06:38:02 GMT 2021","Mon Dec 20 06:38:03 GMT 2021","354","tests.Search","test_success_searching","","","","Проверка поиска продуктов на сайте магазина",""
